{
  "allowed_bytes": 13254542,
  "allowed_tracked_bytes": 2370739,
  "approved_by": "repository-owner",
  "base_ref": "36bed324e4206cb913f03a9dc3d041b9ddda3c69",
  "candidate_identity": {
    "algorithm": "sha256:canonical-json-file-inventory-v2",
    "base_ref": "36bed324e4206cb913f03a9dc3d041b9ddda3c69",
    "contract_version": "aoa-kag:budget-receipt-candidate-identity-v2",
    "excluded_path": "kag/receipts/index_family_budget/cd3ed11dcd349156389219a1d3f56426f761a8999db8766a56254709ab85f310.json",
    "family_digest": "cd3ed11dcd349156389219a1d3f56426f761a8999db8766a56254709ab85f310",
    "file_count": 1478,
    "seal": "7a2c71804e869082d20289898221c1e8392b6fdb3e32372a637774cac825f3e4",
    "source_epoch": "sha256:1233475da8fb2e4290e2db8dc60d83b946fe93949f05dd361fd76db85fb3bd35",
    "source_snapshot": "sha256:0d96d8558e257005ecf29a09b7d937f90cdf71fbb407e42475e04143656f91b4"
  },
  "changed_generated_bytes": 13254542,
  "changed_generated_files": 348,
  "decision_ref": "aoa-kag:docs/decisions/AOA-KAG-D-0039-tiered-content-addressed-kag-distribution.md",
  "default_limit_bytes": 1048576,
  "head_family_digest": "cd3ed11dcd349156389219a1d3f56426f761a8999db8766a56254709ab85f310",
  "head_source_snapshot": "sha256:0d96d8558e257005ecf29a09b7d937f90cdf71fbb407e42475e04143656f91b4",
  "producer_identity": {
    "action": {
      "bytes": 5200,
      "content_digest": "31a155aefaaeb638622b9153b5712f2bfac3356c6bd64d921c429ced2c3c7311",
      "git_blob": "sha1:76741523dfc95fb24ffc1cfbebf5c86a1768380d",
      "path": ".github/actions/repo-local-kag-index/action.yml",
      "state": "present"
    },
    "contract_version": "aoa-kag:budget-receipt-producer-identity-v4",
    "execution_inputs": {
      "action_inputs": {
        "event-history-ref": {
          "bytes": 40,
          "kind": "git-ref",
          "state": "set",
          "value_digest": "297fb68e3ccf9492353157d6ff11f097598e02d0b218d74178bd73e010244111"
        },
        "history-ref": {
          "bytes": 40,
          "kind": "git-ref",
          "state": "set",
          "value_digest": "297fb68e3ccf9492353157d6ff11f097598e02d0b218d74178bd73e010244111"
        },
        "output": {
          "bytes": 37,
          "kind": "relative-path",
          "state": "set",
          "value_digest": "ba839ffc03614b67e111dd7704c623c08d1f50bc2a8e0b694f76fac14dfe062a"
        },
        "repo-root": {
          "bytes": 12,
          "kind": "path",
          "state": "set",
          "value_digest": "21dba821671dd5da139d85927c06f360ae3bcc5751db42dae6d309553c903d79"
        }
      },
      "command_targets": {
        "artifact_root": {
          "path": "<task-local-artifact-root>",
          "path_digest": "7deda7d2c889edafe3208d6dcadd8979d77b16851280f568b6f32da7338c6cf4"
        },
        "base_ref": "36bed324e4206cb913f03a9dc3d041b9ddda3c69",
        "event_history_ref": "36bed324e4206cb913f03a9dc3d041b9ddda3c69",
        "externalized": false,
        "family_mode": "tiered",
        "history_ref": "36bed324e4206cb913f03a9dc3d041b9ddda3c69",
        "output": "kag/indexes/source_surface_index.json",
        "repo_root": {
          "path_digest": "21dba821671dd5da139d85927c06f360ae3bcc5751db42dae6d309553c903d79",
          "resolved_path_digest": "21dba821671dd5da139d85927c06f360ae3bcc5751db42dae6d309553c903d79"
        }
      },
      "dependencies": [
        {
          "artifact_bytes": 64,
          "artifact_digest": "9edb127ba084a4f946ada5dbafdebeca76ce0830d748daaa918d706cd8ca533e",
          "artifact_files": 1,
          "declared_version": ">=3.11",
          "name": "python",
          "path_digest": "748218fa4b2d15dca24128878a38a31690d8b5c2fa637bff46dd3d7bd0bd5b38",
          "required": true,
          "resolved_version": ">=3.11",
          "state": "available"
        },
        {
          "artifact_bytes": 64,
          "artifact_digest": "e534ebea0527e1410b31e641b9eecb89d843bcbab370fbd4c57252d62bb0dcf6",
          "artifact_files": 1,
          "declared_version": "6.0.3",
          "name": "PyYAML",
          "path_digest": "8220e394aa9d2f0206680a6262fa03eb781f0fae98642c318a395b1953e70a92",
          "required": true,
          "resolved_version": "6.0.3",
          "state": "available"
        },
        {
          "artifact_bytes": 64,
          "artifact_digest": "b8804a112d788d53bb483a91f625d2959640eda14f11322133759c416eb3adf8",
          "artifact_files": 1,
          "declared_version": "4.23.0",
          "name": "jsonschema",
          "path_digest": "edb03b9e303abf24f3091737e84dab55637ca9f81c969fd122a7b1399ee0c66f",
          "required": true,
          "resolved_version": "4.23.0",
          "state": "available"
        },
        {
          "artifact_bytes": 64,
          "artifact_digest": "ff0b137e11008f7b0b6be11b2a319d77452dac5b3bd4f886714a716edd05b1c6",
          "artifact_files": 1,
          "declared_version": "0.49.2",
          "name": "jsonschema-rs",
          "path_digest": "a99ab470449c3913d672dd449c908a4ee37b66e40dc290009e2cda45f398210b",
          "required": false,
          "resolved_version": null,
          "state": "declared"
        }
      ],
      "dynamic_imports": [],
      "environment": [
        {
          "bytes": 0,
          "kind": "environment",
          "name": "AOA_KAG_FORCE_COLD_SCHEMA_COMPILATION",
          "role": "validator engine rollback",
          "state": "unset",
          "value_digest": "5a42f60a790863f8c06e57327bf7116900a94dc23154b1e785a0b734d7afaf74"
        },
        {
          "bytes": 0,
          "kind": "environment",
          "name": "AOA_KAG_FORCE_PYTHON_SCHEMA_VALIDATION",
          "role": "validator engine rollback",
          "state": "unset",
          "value_digest": "5a42f60a790863f8c06e57327bf7116900a94dc23154b1e785a0b734d7afaf74"
        }
      ],
      "interpreter": {
        "artifact_digest": "93c136e9b19bb00375bd9cf2bb73f4d23df3a1bf70adecd8d186bd067c20cfe9",
        "implementation": "cpython",
        "invoked_path_digest": "d2c68400f17d98c00601a6731293f7f8c7abd735a42c07a4e1c119493e9d66aa",
        "resolved_path_digest": "d2c68400f17d98c00601a6731293f7f8c7abd735a42c07a4e1c119493e9d66aa",
        "version": ">=3.11"
      },
      "manifest_digest": "b5b79f703fb2ff851fe51c9cfb6bed07127bb346918c7eeee45ad84c39af730b",
      "non_python_inputs": [
        {
          "bytes": 5200,
          "content_digest": "31a155aefaaeb638622b9153b5712f2bfac3356c6bd64d921c429ced2c3c7311",
          "path": ".github/actions/repo-local-kag-index/action.yml"
        },
        {
          "bytes": 8510,
          "content_digest": "b5b79f703fb2ff851fe51c9cfb6bed07127bb346918c7eeee45ad84c39af730b",
          "path": "config/repo-local-kag-budget-producer.json"
        },
        {
          "bytes": 4171,
          "content_digest": "3a32c6d593d88526044b87d2908357c6abfef4ddd4c91fd508b848abadd3b08e",
          "path": "schemas/domain-index-catalog.schema.json"
        },
        {
          "bytes": 3174,
          "content_digest": "e2830a5b37174863afe2576c839041137f104239253642a54af4d75c95ac2e34",
          "path": "schemas/kag-artifact-locator.schema.json"
        },
        {
          "bytes": 6618,
          "content_digest": "ccc39147e7413be5e24f71384fe361d7a175c86b204152c373094a9e666b8c90",
          "path": "schemas/kag-mcp-capabilities.schema.json"
        },
        {
          "bytes": 10670,
          "content_digest": "1516bc25755b26c156a58709c5e7600e276daa21f115d7cdc61031cbd67162d5",
          "path": "schemas/kag-mcp-result.schema.json"
        },
        {
          "bytes": 3726,
          "content_digest": "f435f52f6c179a2d765fdd6c99c25e9ae612fa13814fa722e2a4516033013291",
          "path": "schemas/repo-local-kag-budget-producer-manifest.schema.json"
        },
        {
          "bytes": 15673,
          "content_digest": "eb1878afac28e4d4c02a193abdafc22fd677afec5434513d2e38855b73c43979",
          "path": "schemas/repo-local-kag-budget-receipt.schema.json"
        },
        {
          "bytes": 5760,
          "content_digest": "e351805ebad68471da7471cc185dfaa3dd3c19191a97807df2591d895355c3ee",
          "path": "schemas/repo-local-kag-corpus-manifest.schema.json"
        },
        {
          "bytes": 11102,
          "content_digest": "2de05083ffb332057b8e2341f7789c14c7ce23e41bc45689ebd7f66b079cacc0",
          "path": "schemas/repo-local-kag-coverage.schema.json"
        },
        {
          "bytes": 10502,
          "content_digest": "74a4bf00acc3adc88b9a383119b3b5b962528ead31d05dac05d59f31bcbef6ec",
          "path": "schemas/repo-local-kag-distribution-manifest.schema.json"
        },
        {
          "bytes": 9829,
          "content_digest": "58cab982a2a221a2afc71ab11ff7f6b76adb083546bd6c1b43cc852efc7d4afc",
          "path": "schemas/repo-local-kag-family-manifest.schema.json"
        },
        {
          "bytes": 9692,
          "content_digest": "5dae90151fe9d01295dd8f6926a0d4960e9f4c2c83b7a2e5606e3acd5a03d6f6",
          "path": "schemas/repo-local-kag-federation.schema.json"
        },
        {
          "bytes": 3085,
          "content_digest": "d88cbca895c50b9242696dc5f11cdbcdf5de97abd24db5f31b0a59b1acafc53f",
          "path": "schemas/repo-local-kag-hot-profile.schema.json"
        },
        {
          "bytes": 20391,
          "content_digest": "8dfcd806e1bd43e2064b91cdf620e217f53dd4e222d2b73195263cef3939055d",
          "path": "schemas/repo-local-kag-index.schema.json"
        },
        {
          "bytes": 10167,
          "content_digest": "a7c309613dbb59cbf792ff12fb4573c971cd245cfdb7cbca6d15c84bcd9301e7",
          "path": "schemas/repo-local-kag-query-result.schema.json"
        },
        {
          "bytes": 20876,
          "content_digest": "7335d46c5716fa05577e52925815bf922f16df7a19303e06541d8b25f26f1fe2",
          "path": "schemas/repo-local-kag-repository-index.schema.json"
        },
        {
          "bytes": 5531,